Username,Comment,vader_sentiment
@FaradayAcademy,"Hey everyone, thanks for watching 
If you want to support my work, I wrote a book on learning to code: https://amzn.to/3a911Rk (US) and https://books2read.com/u/4DgO8D (worldwide)",1
@hassansyed6087,"Gotta love humans who just give thousands of dollars of knowledge for absolutely free.
What a wonderful individual 
Thanks for this",1
@panamafred1,"When you said CD = Change Directory, I went into a time warp. I bought my first PC in 1984. It had a massive 10 meg hard drive! I knew absolutely nothing about computers. Didn't even know anyone who had one. The computer came with a thick three-ring binder with the title, DOS. I read and reread and reread the entire book until it started to make sense. (The first version of Windows didn't come out until 1985.) In 1985, I bought an early copy of Symantec's Q&A, a (non-Windows) word processor, flat file, and report generator, which relied heavily on keystroke combinations to get things done but was hinting at a graphical interface. I ran a non-profit for many years with Q&A and loved it, such an improvement from WordStar. So, now at 72-years-old, to see CD = Change Directory, I say to myself, ""Hey, I can do this."" Thanks for a good tutorial.",1
@WendyLiChinLim,"Gwen articulated this topic so well and was able to break it down into simple terms for a newbie like me. She also explained everything very clearly, showcasing her intelligence in simplifying complicated concepts with ease. I am very grateful to have stumbled upon this video.",1
@siriusvatsa,"TimeLine
1:10 What is git
1:30 What is version control
2:10 Terms to be learn in video
 Git commands
 sign up in github
 using git in local machine
 git install
 getting code editor
 inside vsCode
 cloning through vsCOde
 git commit command
 git add command
 commiting
 git push command
 SSH Keys
 git push
 Review  workflow so far
 Compare between github workflow and local git workflow
 git branching
 Have fun is not allowed
 Forking in git
 Ending",1
@fabriciosaavedra3795,"I don't usually leave comments for tutorials, but let me say, this one fit like a glove to my newbie needs. Thanks a lot!",1
@anuvapandya8287,"Whole course was broken down into heading and sub-headings, spending time on important ones and you made sure the basics were clear to the students, viewers or learners like me. Thank You Gwen.",1
@illhaveawtrplz,"What an amazing explanation, thank you so much for being so clear and concise!

A tip for new learners like myself: This video is slightly dated. GitHub now refers to the primary branch as ""main"" and not ""master"". If you try to run these commands exactly like Gwen in the video, you'll run into errors. Remember: main ️ master ",1
@unknownuser6577,"This tutorial is probably the best github tutorial any beginner online could make use of. The lecture was succinct and it passed the desired information to the viewers, not having to make things overly complicated, she explains it so well.",1
@mohammadfallah.rasoulnejad5379,she is the most fluent instructor that answered all my questions while i was watching... imma go to her channel and subscribe rn.,1
@MegaRomza,"At some point I thought I was dumb for not gasping the concept of git and GitHub because I’ve watched over 5 courses which were paid but I was getting even more frustrated. But here you are making it all clear, now I have the ahaaaaaaaaa moment. I’m in love with your teaching methods, they make sense to me and now I can rewatch those other courses. Thank you very much!!!",1
@obotandino2941,4 years after and this is still insightful. Thank you so much.,1
@josemgarlla74,"Really love this git and github intro course, it really touches a lot of things.
1. How to create a repo locally through the CLI(Command Line Interface) or directly from GITHUB
2. git flow by using the most common commands: git add - git commit and git push/git pull, all of them with their corresponding explanation. What ""origin"", ""remote"" and ""master"" mean.
3. git branching: all the commands involve in that kind of operation as well as best practices.
4. git merging: when we use a ""feature"" branch and it's time to merge to the ""master"" branch  -- PR (Pull Request) on the Github side
5. How to deal with ""conflicts"" when merging.
6. Undoing in git: undoing from the stage area versus undoing if we have committed once or several times.
7. Understanding how and why we fork a repo on github.


Really awesome content, thank a lot for such a valuable content.",1
@adraintokyo7994,"This is an excellent, detailed tutorial for Git and GitHub.  It’s long, but easy to follow, not least because there is no distracting music, no annoying jingles or graphics and perhaps most helpful, the narration is measured and carefully modulated ... you quickly feel at home with the delivery, from someone who really knows their subject material.",1
@kaitoti,"Thank you, 
Maybe some suggestions, 
 - add the changes of github defaulting to ""main"" instead of master and the configs on it.
 - Setting up SSH keys(20:30) first must be earlier than the cloning through VS Code(14:30), so we can follow along",1
@jmdavaul,"This was much better than I expected it to be.  Very ""no fluff,"" clear, and bite sized.   You can find these topics in many places (youtube, udemy, skillshare, etc) but most instructors can't seem to explain these topics  plainly.   You did exactly that, nice job.  You covered the core concepts of branching, merging, PR's, conflict resolutions, and undoing changes in very easy to follow and digestible steps ",1
@AbdulRahman-n1g,"Here are git commands to remember:-
1. git status
2. git add .(for all) / git add <filename>
3. git commit -m ""message""
4. git commit -am ""message""
5. git push
6. git push -u origin <branchname>
7. git pull
8. git branch
9. git branch -d
10. git checkout -b <new_branchname>
11. git checkout branchname
12. git reset
13. git reset <filename>
14. git reset -HEAD
15. git reset -HEAD~1 (OR) git reset -HEAD~2 and so on...
16. git reset -hard <commit_code>",1
@vishakarudhra8665,"For beginners like me, who might be feeling lost with commands not working in the VS code terminal, all these commands will work on Git Bash since it can interpret all UNIX commands and git ones, on the top of it, it will track the edits you separately perform on VS code. So feel free and just git bash through this course.",1
@_AnikSaha,"At 21:43, One important note:: If you choose a new name instead of automatically generated location, you have to use that location name when adding configuration code to the [~/.ssh/config] file. Nice tutorial. Thank you.",1
@vigneshwarselva9276,"i'm a non native speaker of english, what i loved a lot here is your slow n steady way of illustrations, was a nice video .. thanks u so  much",1
@GTFreeFlyer,I finally understand Git after this video.  I’ve asked so many questions to friends and watched several “quick” YouTube tutorials and was still confused about Git.  Your tutorial was excellent and I’m glad I sat through the whole hour of it.  It was completely worth my time.  Thanks!,1
@manelariapala7852,The first ever instructor that actually explains the meaning of each jargon! Thanks @Faraday Academy!,1
@DefnitelyNotFred,"Absolute masterpiece of a Tutorial. I'm an electrical engineer working as a Data Analyst with Energy Data. I'm trying to shore up my programming credentials as a Data Scientist because I'm trying to change jobs and have failed a lot of interviews for not having enough knowledge on Git, so this guide is very welcome :D",1
@GreatBibleStudies,"Gwen, your video is great! I love how everything is broken down into bite-size chunks. You have a wonderful gift of teaching. You've helped this beginner get closer to becoming a competent user of Git & GitHub.",1
@SiddharthMathur2k007,The most complete tutorial for beginners I have seen on YouTube so far! Thanks a lot!,1
@doniyorallabergenov7970,"Took me 5 days to completely learn your 1hour course but I repeated it over and over until I completely got it! Very useful, no nonsense and easy to understand. The only thing is, I think the location of SSH keys in the video got changed and placed after 'commit' and 'push' but it is necessary to set up before those steps. Took me a minute to figure that out. Thank you so much!",1
@joseortiz_io,Version control is definitely a crucial tool for developing software. Thank you for the education! ️,1
@guitarman813,This so far is the best (free) course that I've seen on Git and GitHub. Bravo Gwen!,1
@cosmo_gon,"Gwen has such a clear and pleasant voice and a perfect diction! Likewise, she has a very good teaching skills. Thanks, Gwen!",1
@oldlorenz9567,"I 've watched a lot of Git tutorials, and this is for sure the best I've ever seen. Thanks !",1
@mikeantonin7580,"This was a highly comprehensive and helpful Git tutorial. It was definitely worth the full hour because unlike other shorter tutorials, it covered everything extensively (with appropriate examples too) thus helping me to properly understand the basic concepts and operations of Git as well as use cases, Thank you very much!",1
@ojeleyeopeyemi656,"This will go down in history as the best Git and GitHub course for beginners! Even if one is a dummy, one will still get. Kudos.",1
@whoismikeyuk,"This has to be the best introduction to git and GitHub I have seen to date (yes, I have tried watching a number of videos). Easy to follow and clearly explained. Finally understanding ""git push origin main"" (changed from master) was my favourite part. Thank you.",1
@sakthipro_YT,"Extremely useful, sharing a fewthings..
For latest Windows client on VScode,

1. Cloning via ssh doesn't work but via https does.

2. On Key generation, SSH for rsa doesn't work, but the new syntax & algorithm ed25519 published in Github help page works.

3. Same for starting & config ssh agent, the github help page commands worked.

Thanks a lot for this video.",1
@sauravroy3420,Really like that you took the time to explain each concept in detail for a beginner like me,1
@bernardbakala9241,I learned more that I expected. Thanks a million for such a complete course.,1
@kirtperez9938,Y’all are amazing! Pumping out this much needed content especially during these times.,1
@saurabhbhardwaj7951,"I have been making mindless commits and PRs without realizing what they actually meant. This course fills so many gaps and answers most of my question regarding why we do a certain thing in Git.
Thanks a Lot!!",1
@abdulhannan288,"This is exactly what a beginner would need ..
a great course covered in so timely manner",1
@CSharpProdigy,"This is top notch I must say. I rarely give comments, but by default I'm doing so now..",1
@briankaboyi-j1e,"As a beginner, I've understood a lot about git and GitHub that I was struggling with just by following along with this video. Thanks You",1
@user-di4js6xw9n,"absolutely loved this video! as someone who was absolutely in the dark about how to use git and github, this crashcourse most definitely provided me with all the necessary information a beginner would need! thank you! :)",1
@mattmovesmountains1443,"So helpful and well-explained. As a new coder, I'm in near disbelief that this is the setup process for what seems to be the tool used by every professional coder. That said I'm even more thankful you explained it so well.",1
@alexandergracilla1394,This video has better sound quality than the ad that came before,1
@faraza5161,This was definitely one of the best git tutorials I have ever come across. Big Thanks Gwen!!!,1
@piyushdongre325,This has taught me all i needed to know about git which i was delaying for a long time. Thank you :),1
@icono__7136,"I feel so relived; I'm finally learning this darn thing! Thank you for the tutorial. Thank you for taking the time to do this Gwen!

Edit: Upon reviewing the tutorial again, I'd like to say:

1. When creating a tutorial, you guys should  understand the importance of slowing down to the pace of the learner. In the beginning you walk us through a nice set of key terms (which was exceptional), then start mixing lots of advanced and beginner-level concepts together in your explanations, confusing the person that's watching the video. Slow down, explain like we're 5, that's why we're here.

2. To expand upon the issue of mixing things up I mentioned above, it's okay to keep a tutorial short, and add footnotes later if you think that the advanced concepts you're touching on are still worth being aware of. That way, the beginner can truly focus their attention on the basics, and then access the footnote only when they feel comfortable with the knowledge they've acquired thus far, making the content of your footnotes even more effective. After all, isn't good programming about being efficient? 

I used to get annoyed at being expected to take additional English classes as a Computer Science student, but now I understand why. I spent 4 hours yesterday debugging a Terminal issue, only to later realize that there was an ""issue"" because the person who created the how-to GitHub document instructed the reader to paste this code into the Terminal command line: 



They said to  this command in the terminal (meaning: include the quotation marks). After 4 hours of learning about chmod, File Links, Groups, root directory, Inodes—things I knew NOTHING about prior to this, I resolved my problem by simply removing the quotation marks. 

Now, the arrogant developer might say, ""Well that's obvious"". No it's not! The person said ""paste"", meaning I would: 

- Select the piece of code
- Apply ctrl+c to it, for Windows (cmd+c on Mac)
- Go to the Terminal and apply ctrl+v/cmd+v

Either the tutorial should have been made like this: 

 ,  

or the person writing the document should I mentioned that the quotation marks need to be removed. 

As Software Engineering becomes more collaborative, programmers can no longer get away with being asocial, and communication impaired, so this is an area a lot more engineers need to start being proficient in .",1
@CassCodeIt,"So as a self taught developer this has not been my first time looking into Git, but this the first time commands lines were explained even better which is good. 

Most places I would only get commands and work from there not knowing how to and when to use them.

Gwen here, did a great job explaining and sharing the common usage and howwhen to. I am now confident to continue working and learning git.
Thanks greate content.",1
@samuraijack5919,"When I get my job in web development, you can be sure that I'm coming back to help you guys out.",1
@rerere7702,I'm literally five minutes in and I can already tell that you put great detail into this video. Keep up the great work!,1
@jinyoungchoi3443,This video is amazing! I failed to understand Github for several years until I came across this video. Thanks!,1
@tjex,"21:34 - you need to type in the full file path with the desired file name at the end. eg. /Users/tillman/.ssh/[insert desired file name]
Otherwise it just ends up in the root of the Home folder. Just so people know. Could cause confusion.",1
@VishalGupta-xw2rp,You People are like a Blessing... Like Water in Dessert... You People are too Good for us. May the Force be with you️🇮🇳,1
@JIHYELEE-h2m,I'm not native speaker of English. So I really appreciate your speed of speaking. Thanks a lot!,1
@alanmurray4011,Thanks Gwen. This is the best beginner tutorial I have come across for Git and GitHub. What makes it the best is that you don't assume that any bit of information is too trivial or unimportant to mention. I feel a lot more comfortable on the topic now. Thanks again!,1
@Kawaremu,I really learnt many things out of this video and I'm finally able to dive into version controls softwaare yeeeea!,1
@criscrawford4615,"Thanks - I forgot everything ""git"" in the last year and relearned it all plus more after watching this one hour video.",1
@ei_acc,"If you're a new to web development this is very important, precisely what I was looking for. thanks for this amazing content",1
@bkatsevych,Probably the best Git and GitHub crash course newcomers can have. Thanks a lot for a perfectly done job!,1
@SuperLm21,"The way you are explaining your voice timming is just perfect to go along . I´m confident using Git now and it´s no longer a monster , off course it needs practice . Thanks from Portugal!",1
@user-vq5gv1vg3w,"You did an amazing job, I don't collaborate on any projects and just used git for tracking changes over time, making my github page look busy, and project copypasta. But this reminded me how immensely useful git is; built a reference guide around your video Thank you!",1
@thecalgarians4597,"It's the best Git / Github tutorial out there and that too at no cost to the learner.
Amazingly explained all important and, I believe, the most commonly used git commands / Github operations in such an easy to understand manner.
I feel so confident now in using git/github from earlier being a Zero in this space.
I'd spcially acknowledge the slow pace of Gwen's speaking while explaining all these concepts.
Wonderful job done, Gwen.
Thank a ton!!!!!",1
@tradewithaakash2939,5 min into the video and i already know that this is the correct video to understand git and git-hub.,1
@MS-wv8nk,"Gwen, your tutorial is absolutely excellent! I am so grateful for IT pros like you! You are very clear, thorough, detailed. I've always wanted to better understand Git & Github and I believe you are my answer to learn how to make use of these great tools. It's SO nice to have a non-judgmental pro who makes sense and doesn't teach as if most of us out here already know what the tool does and how we can benefit from it. Hopefully I can teach my friends in time. I've just become your newest subscriber, so many thanks and please keep up the excellent teaching. I'm excited and now engaged...I've just got to make time to learn it and learn it well.

Much respect.
 - MS!",1
@charlesagyei9200,The best Git tutorial I’ve ever had. Straight to the point and clear explanations to the important features. Thank you so much,1
@bahador924,by far this was the best course on GitHub I have ever seen.,1
@EricTighten,"Just to make it clear, if you don't have your ssh set up yet, you won't be able to clone the repo to your local machine, which is at around 15:05 of this tutorial",1
@brickviking667,"Thank you for this course, it seems to be a great refresher. My only comment about the content is that at least at my end, the audio is really quiet in comparison to a lot of the other videos I look at. I'm not sure if this is deliberate.",1
@prabhatkumarsingh5728,"You guys are awesome, I was waiting for this video and here it is only in few days ",1
@bkahumuza,Thanks Gwen for one of the most clear explanations I have had in life. Was lost till I found this Video. Thanks!,1
@theshilpitube,"Thank you very much! I learned a lot! I wish you'd add a git log after the last git reset that you did... but it's okay, I can always recreate the project and see how it looks. Thank you again for this tutorial! You are a good teacher!",1
@aldrinseanpereira140,"When first opening the terminal in VS Code,  on the terminal bar just change from ""powershell"" to ""Git Bash"" and then follow along",1
@chahalamit,Best Github Tutorial so far! Hands down. Couldnt appreciate more that how she has considered detailing the tiniest of things about git and github.,1
@iMiike69,"Much appreciated Gwen! This is one step on my long journey into programming, this was all very useful.",1
@enriquelmx,"at 16:57 the equivalent Powershell command to ""la"" or ""ls -la"" commands may be ""ls -force"" or ""Get-ChildItem -Force"". The ""ls"" command in Powershell is a Get-ChildItem alias.
Edit: guys I found this command really useful to see all the commits in different branches more visual-friendly: git log --graph  , you can add --oneline to display the info more summarized.",1
@rayfagalde423,best tutorial ive ever seen. bouta save my grade like a super hero,1
@basilali9767,Amazing platform for ever...i didn't seen ever before..i'm always waiting this video,1
@lckylke5751,"Showing hidden files on windows and in powershell wil work with ""dir -Force"" :) Good Tutorial btw",1
@syundown6005,"Amazing tutorial, being a comp info systems student the only class I ever had that included GitHub only involved us uploading a Google Colab notebook to a GitHub repo a single time and from there every project I ever had just immediately assumed I knew how to use every corner of Git, so I'm only half way through this tutorial and it already feels like it has taught me so much.",1
@patrickvandersluis2796,"Gwen, once again you have created the exact video I needed. Thank you for the effort and commitment it takes to professionally produce these pieces. I have enjoyed many of your tutorials.",1
@khatwanik,Thank you Gwen for creating this simple and easy to understand content for both beginners to learn git basics and for experienced professionals to refresh and reinforce Git command line skills.,1
@dannywadhwa1759,This was a great video to get familiar with the Git concepts in order to start working on it. Thanks Gwen,1
@wesjonm,This was an incredible tutorial on Git! Very easy to follow and understand. Thank you,1
@Badalkumar-me9ok,"Such an excellent teacher, I had many problems understanding Git and Git hub now I completely understand all that stuff.",1
@Shad1991,"First time seeing your tutorial and I'm so impressed...structured and easy breakdown of git and github..thanks so much
Your channel will become a playground for me now.",1
@allishagreen4385,"OMG thank you so much for this video
 This was right on time for me. Please keep the awesome videos coming I greatly appreciate them ",1
@middle-agedclimber,This is the most comprehensive tutorial I have seen.,1
@julian_pp,thank you! I was looking for something like this. Good job Gwen!,1
@mong4491,The SSH KEY part should be moved up to the creating GitHub part......,1
@hosseindadashi3578,simple and fluent. That is what we need nowadays. well done Gwen ;),1
@erisaround,"if you can't use git bash instead of powershell in the terminal:
1.Reinstall Git Bash to primary drive (C:).
2.Check ""Add a Git Bash Profile to Windows Terminal""
3.Restart VS Code",1
@uyiosaakpasubi6052,"Thank you so much for this, it was a really amazing video. I had a few issues setting up for windows ( had to download git bash), also I encountered a problem using the Personal Access Token (This comment is from December 2022 and the fine-grained token is  in beta) to push to github . I resolved this by using the classic token",1
@parlezvsfr,"Excellent tutorial ! Very clear. I spent last 2 - 3 hours following it step by step and I understood everything ! I had no difficulty in reproducing the path. And it is very practical. I am a UX UI designer, so a bit impressed with the code. But that was real smooth. Well done !!!",1
@carlosvenegas8981,Hi what extension in vscode are you using to show git: (master) and in color?  thanks,1
@nabarupghosh9743,"We just asked for it ...
And here they are",1
@altaykaan,"It is well organized video, thank you with a perfect narrator",1
@emanimal,"Hey Gwen, love the material I learned a lot. Thank you so much for taking out the time to do this,  myself and I am pretty sure others definitely appreciate it. Questions what is the extension you use on VS Code that gives you that nice looking late out and helps differentiate things. Maybe you can run by some extensions you think would make VS Code easier to use. Thank you.",1
@beinerthchitivamachado9892,"Short, Sweet and to the Point. EXCELLENT VIDEO.",1
@balijeanbirba3456,Excellent tutorial course of Git and GitHub.,1
@nguyenvanthang7387,"Love freecodecamp contents. Super easily undestand, infomative and total FREE.
Could you make a tutorial about devops, CI/CD. That's would be a complete flow in software development. Anyway, many thanks <3",1
@nurullahates4585,"terminal keeped asking me ""username"" and ""password"",  ""git config --global credential.helper store"" command solved my problem, after ssh creating, adding, config file generating.",1
@tavettehepburn6154,This really helped clarify the difference between the different workflows based on whether you start with a local repo or a repo that is on Github. Thanks so much!,1
@donaldli1864,I love your hair style. For the past 10 months I have shaved my head 4 times,1
@ChaneLX645,Watch this in 1.5 speed,1
@antilovehyk,thank god I end up in video where all my question are answered. even the git for dummies book doesnt explain the jargons and i was confused. this is a really great tutorial.,1
@imed-boumalek,"""I tell the waitress i wanna a fork""- the Italian man  who went to malta, 2005",1
@karthikbachawala,This video helped a lot. I have never used this technology but it was easy to learn. Thank you!,1
@c38ns,This is the best Git/GH tutorial I've ever seen.,1
@anubisystems,This is definitely a master class! thank you so much!,1
@vvidalftw,"I just want to thank Gwen and all the amazing team at FreeCodeCamp, who make possible for people like me to learn this way. I'm feeling very motivated to keep learning to improve my skills. I'm a sysadmin wanting to become a developer, so this course worked pretty well to learn about git and getting used to syntaxis used in git.
Now I'm one step closer to it.
Thanks again and keep the good work you people are doing.
Regards from Chile.",1
@HolymanFMZ,"You don't realise the way you just save my entire career, That's really for dummies like i was in the beginnig of your tutoriel,

 thanks a billion times",1
