Username,Comment,vader_sentiment
@percys8774,"Starts off ok and then starts rapidly jumping around and loses beginners. Doesn't specify where to type in the ssh-keygen. Are we still in VS Studio? It's amazing that new IT people ever get trained, because every expert is unable to go slow and explain things step by step. So sick of getting ditched by instructors because it's so easy for them and they forgot what's it like to be a beginner.",1
@Aepus,"Just wanted to say, this helped me out a bunch. The terminology breakdown at the beginning was very appreciated as well as your well-paced explanation. Thanks for uploading this!",1
@kevinlomeli801,I'm not a native speaker. And the voice of this girl is so useful to understand this video.,1
@kalucardable,This is on par with expensive courses seen on Udemy and Coursera. Thank you for making this tutorial.,1
@apurbajitdas,"Short, Crisp, To the point. Wonderful Lecture",1
@JorgeFoody,"I am pretty new to Git and I liked your video very much. First I think that the explanations are super easy to understand and second I like that you are using command line and git hub to show the features.
I will now be searching for release management with Git, but you gave me already some nice ideas. Thank you",1
@petsco3623,this is prolly the best git and github tutorial out there,1
@umamiimamu,"u did a great job, the best git and GitHub tutorial on youtube I could find. really appreciate what this channel is doing ! Love all u guys <3",1
@valentinlazar22,"This video was very helpful to me. It was also my first git video and I really got the concept. I don't know why, but while watching this video, I felt like a part of a community working together towards an end goal. Thank you very much!",1
@shalinichatterjee204,"This is by far the best best best video I have seen to learn GITHUB, thank you so much Gwen :)",1
@fadinimer4574,"for a long time wanted to learn Git & GitHub and this video explained just right to me. 
thank you so much",1
@danhle7999,in 16:31 for someone using powershell 7.x on windows 11. it's `ls -h` which `h` for hidden files.,1
@aniad264,"I am a total noob but this tutorial is very straightforward. Amazing, thank you!",1
@vivektelang,"This was a great tutorial, exactly what I needed. I liked the way you boiled down so much content, and kept it understandable, without going down every rathole. I might have to go back to watch the merge/fork part, but this is all I need for now to get started. Thanks!",1
@ericlimbe3876,Greatest video on version control. Still relevant in March 2023,1
@fernandoguimaraes4415,For sure one of the best videos to watch while you learning to code,1
@srivathsan8853,"Very good guide for beginners. Now from my Zero knowledge in Git, I have got some basics understood from this video",1
@ardabaysallar2029,"wow! so helpful, I was rusty and am now feeling refreshed and shiny again. ",1
@camillecorti383,"Tutorial is clear, concise and voice is so NICE!  I am watching on the Eve of Bitcoin's 14th bday. Thank you, Gwen, for your contribution to decentralization. I <3 u",1
@mediaconsumption1452,This is the best git tutorial on YouTube,1
@rskmahesh3531,One of the best tutorials on the entire internet.,1
@johnnosek731,"My feedback: this was an incredibly helpful overview of how to use git.  Thank you.  I've been using it for over a year now but some of the commands I just ran because that's how I'd seen more senior devs do it.  I really appreciated you explaining what some of the arguments mean (e.g. HEAD, origin, -u).  I know there is a ton more that git can do but from my experience this will give people 90% of what they'll ever use git for.",1
@Daniel_Ikenna,Amazing crash course. I just refreshed my knowledge on Git and GitHub with this course. Thank you,1
@binyamtilahun6417,"Gwen, thank you for creating such a clear and informative video on Git and GitHub. Your explanations were particularly helpful, and I appreciate you taking the time to share your expertise.",1
@mannistudio,Excellent tutorial!  Wanting to learn this 'properly' for years.  Salute!,1
@AmitYadav-rp3ot,For me this was the best video on getting started with Git. Thank you so much for the great explanation,1
@estereotipo20,best Git tutorial I have found. I finally understand how this works and I am looking forward to continue using it. Thanks Gwen,1
@christianleleux2535,A warm thank you for sharing your broad experience in such a clear way. First time I've the feeling to understand GIT in real workflow. Have a gooooood day.,1
@gustavocortez6569,"yoooo this is amazing! I love how you repeat the steps slightly differently. It really helps me understand how things work. I'm just a salesguy but this has been auper helpful, thanks!",1
@chaceciulla9783,"Great pacing and easy to work alongside. Loved making all these commands work for the first time and having it all ""click"". Thank you!",1
@rafaelsantos9086,"absolute beast of an instructor, thank you dearly!",1
@philipheah6557,What a great lesson. Learnt a lot in just 1 hr. Great job. Thanks Gwen.,1
@adnanmumtaz4479,"Gwen, You made this tutorial easy for newbies as well. Hats off to your. Keep up the great work.",1
@Aldedandra,"This was an amazing tutorial. I only knew of GitHub, but wasnt aware of the difference between Git Hub. As a beginning and aspiring developer, this was very informative. Thank you!",1
@samuelogundoju6365,Thank you. I finally know how to find my way around git and GitHub thanks to you.,1
@werekublaise4651,My first video to Ever complete on freecodecamp .. doing each practical step by step with a full understanding .. thanks you ma,1
@obinnasunday2823,best lecture on youtube regarding this topic,1
@francisegah6115,This is literally the most direct git tutorial i have seen. The explanations are very clear and easy to understand. Will surely recommend this to my colleagues.,1
@foruzanhamedi6448,"you are absolutely awesome your voice, your slowly explanation, your knowledge everything. thank you so much",1
@evanwarren1010,"while i'm aware this is terrible reasoning, it's amazing how quickly I came to trust you as an educator after seeing the character lineup of Mother 2 on a shelf in the background.",1
@SifuNH,"Hello Gwen, Thank you for this tutorial. I support a plugin for VS Code and felt I needed to understand Git better to support my plugin. Mission Accomplished!!!",1
@suhud-al-yeqeen,Many thanks for this Gwen. Your explanation is comprehensible for beginners and intermediate alike,1
@roelyoon,"Thank you for the amazing tutorial! As a beginning dev, you've taught me a lifelong skill in just an hour!",1
@Ramya-z6x,Thoroughly enjoyed learning the git and github concepts. Explanations are very clear.,1
@jaimegarcia8447,"Loved this tutorial. Perhaps the best git tutorial I've found. Gwen's explanations are as clear and concise as they can be. 

That said, I feel the conflict management bit might have been expanded a bit though (I found a bit surprising that the conflict was fixed in the test branch but master was behind when the section finished - my knowledge is very limited so I might be talking rubbish though).",1
@DheerajAeshdj,i got a clear understanding of how git and github works. thank you.,1
@tantegreta,"Thank you, this is really good stuff. 1 hour and I know everything I need to know to start my project. Concise and constructive, thanks a lot!",1
@zoezou748,this is the best video ever for github beginner! thank you Gwen!,1
@anudeepnayakoti,"Its a great course for complete beginners to learn about GIT. I used Git from many years, but wasn't aware about importance of the ""upstream"" command. This course made me understand it. Thank you so much for your efforts. I appreciate it.",1
@OracleOfSages,Wow awesome video! You are helping so many people get starded in their journey to software engineer! Me included!,1
@orhannaseri,Thank you so much You saved me from a big problem. I was stuck on this topic for 2 weeks but your video helped me.,1
@mordest_porcket27,Had fun learning from you. However one thing you can add is to show how the processes differ between mac an windows i had a lot of issues following along since i primarily use windows. however i got insights from GitHub publishing.,1
@MariaAkterRimi-h9y,Your pronunciation is so clear! and the video of course was so good!,1
@uzairmughal4976,I am addicted to this channel already,1
@jk377y,Wonderful explanation.  I just started a coding bootcamp and this was a great help.,1
@NsorEnya,Gwen! This was amazing!! I feel so confident with Git and Github already...thanks a lot!,1
@Ajoi14,That was a really nice intro! Now I understand the Merge Conflict way better! Thanks Gwen! ,1
@savithpanamgama2107,Got introduction to git and GitHub madam. Learnt a lot!!,1
@edwinantonius63,"Great explanation of how to use and integrate Git and GitHub into your IDE. Scrolling through the timeline it seemed that I could skip some topics since they don't cover the exact information that I was actually looking for. Only to find out later that one by one, most if not all of my questions are answered in these topics. Pleasant surprise. Great work!",1
@hackeymabel8296,love all the hotkeys included in your speaking,1
@bl.fl.,Thank you for the tutorial! <3 This is the best explanation for Git & GitHub I've found so far and I've been looking for a while! It's perfect for super beginners.,1
@mohammedelhassanhabiballa5700,You made it as easy as butter!. Thank you so much Gwen,1
@ManishKumar-cz3ud,Thank you Gwen! I really like the way you narrate.,1
@carolinamora1926,I'm branching into technical writing and this is an amazing class! Thank you!,1
@vandanpandya9587,A nice and intuitive video explaining github and its functionality.,1
@tejasbawa,"Thank you for getting me started in Git/Github, this toutorial was a great help",1
@AbhishekRavinuthala,Hands down the best tutorial i came across. Thanks a ton!,1
@theinhtetaung7193,Thanks!,1
@RajeevRanjan-zl8nw,Thanks for this amazing tutorial. It was very concise and clear. A must watch for everyone struggling with git and github.,1
@timbald,Superb. Thank you. >4.3 million views says it all. Brilliantly done. Good use of time back in Covid!,1
@shravanpopstar,Thank you for the explanation. I am new to git and this gave me a clear overview of the git mechanism. you're great!,1
@joaopedrovoga5497,"As a newbie programmer, I can't believe I was just saving all my projects to Google Drive until now!",1
@ken-sims,This was a great tutorial. Very easy to understand. Thanks Gwen!,1
@evrarddylane6449,"masterpiece
I'm so grateful I watched this tuto.The Lady is really good at explaining",1
@The3biscuits,This helped me set up git and github access for the first time. Thanks!,1
@Jahuni..,"This video was my introduction to Git, @FaradayAcademy is an amazing teacher. I am about to buy your book; this is how I say THANK YOU and show my support!",1
@alexmondragon2594,"Hey guys, if anyone see a "".DS_Store"" file when you commit (with mac) , be careful! Usually this doesn't show when you have a "".gitignore"" file set to ignore it in you app's folder. Probably Gwen turned off the automatic creation of this file globally in her terminal by running: defaults write com.apple.desktopservices DSDontWriteNetworkStores true

You can turn it back on by running: defaults write com.apple.desktopservices DSDontWriteNetworkStores false

Thank you so much Gwen, FCC and this amazing community!",1
@davidesther5987,"TimeLine
1:10 What is git
1:30 What is version control
2:10 Terms to be learn in video
 Git commands
 sign up in github
 using git in local machine
 git install
 getting code editor
 inside vsCode
 cloning through vsCOde
 git commit command
 git add command
 commiting
 git push command
 SSH Keys
 git push
 Review  workflow so far
 Compare between github workflow and local git workflow
 git branching
 Have fun is not allowed
 Forking in git
 Ending",1
@unlimitedRewind1,At 24:55 I place bookmark. Thank you for the course.,1
@bearcountrypublishing5303,Thanks so much.  I have been struggling with git.   I've broken to many of my repos for sure.  I think this new knowledge will help me so much.  ,1
@davidk7212,"I still can't believe Git actually changed the standard name ""master"" to ""main"". The sensitivity and the pandering truly knows no limits.",1
@arjunsemwal02,Thank you so much Ms. Faraday for sharing this great and helpful easy to understand tutorial ,1
@ph7305,"Thanks so much! At last I found a video for Git and GitHub that was clear, understandable! Great help.",1
@shreyasrivastava693,It was just great watching the video! Such clarity of teaching.,1
@22niloc,Thanks for this course. I found it really helpful and easy to follow along to. You get straight to the point with not a superfluous word within hearing...,1
@masoodahmad8897,It was an amazing and detailed video on Git and Github. I will highly encourage all the beginner to do watch this video if you want to learn git. Thank you so much Gwendolyn Faraday!,1
@maurobompadre7772,most clear git tutorial ever. kudos,1
@johnmahugu,Fantastic! Bigup from Kenya :) Thanks Gwen.,1
@haoyuyang3720,The best git n github tutorial online!,1
@JamesJianDev,"This was a very insightful course into the fundamentals of GitHub for a newbie like me, so thank you! The bit that helped me a great deal was the brief workflow review clip at 30:26 that concisely went over the difference between Git flow and Git Hub flow. Once I understood that, the way Git works became less mystic and more understandable!",1
@MsEdnira,Thank you for this carefully made and clear tutorial. Git is still a mystery to me  but things start to get more clear,1
@julian1971,Thanks,1
@user-vy3ed4gu5l,"Very good tutorial with just the right amount of detail. I enjoyed it, thanks for making it!",1
@hades306,Great introduction to GIT and GIThub! Thank you,1
@alisonoz7219,what a great tutorial!! I followed till the very end of it and I highly recommend it!,1
@kanhaglobal,Excellent Intro to Git and GitHub!  Thank You.,1
@ahmedshakkhor8329,"Your video was great. Learned a lot , thanks!
Although I have 3 points to address:
1. You didnt mention to switch to gitbash from powershell
2. SSH key part was not clarified for windows users
3. After fixing merge conflict, I didnt know what to expect on my repo.",1
@vihangaherath2772,"The best GitHub tutorial for me, short and accurate ",1
@vasileioskaragiannakis3792,Hi Gwen from Greece. Thank you so much for this educating course,1
@gabrielade775,"Great video,  very smooth obce you get past the ssh keys. Great work Gwen",1
@aaliyafathima2999,This was a really informaive video. I got to learn git and github really easily. I was worrie it would be complex but this videos was just really easy to digest. Thank you <3,1
@AlfonsoMonserrat-s4z,Thank you for this. You applied the knowledge to the day to day of a developer. ,1
@olekingkinga9151,Good work and support GwenFaraday. Much love.,1
@sjoseph6533,I appreciated the headings in the video to break it up :),1
@Sunils_Creations,"the explanation was clean and simple, Awesome video for beginners.",1
@dasanv7016,Clear and precise! Wonderful presentation.,1
@saurabhdp,"Just FYI,
25:36 
Due to the recent replacing of 'master' with 'main' in GitHub, 'git push origin master' may not work. 
Use 'git push origin main' instead.",1
@BOMGlobalStrategy,"Thank you Gwen, I'm completely new to programming but I'm resolved to give it a go",1
@p21072,Thank you so much for making this tutorial available for free got to learn a lot from it,1
@cliffordbenoit5500,"Gwen you are amazing, thank you very much for this great tutorial, you explained this masterfully. You got yourself a new subscriber",1
@AdityaRaj-lj5wf,A very good to cover all the basics. Thanks a lot Gwen,1
@study-me1oe,Thank you so much ma'am for a video on Github. Your way of explanation is as good as you,1
@himanshujangidd,"Thanks a lot to you for bringing out this to us so simply and descriptively. I was facing a lot of problems in using the git and github ,after going through this video, now i have a complete idea of how to use all these features. It  was truly an amazing  explanation , Once again thanks a lot gwen ",1
@usheeg,The best video I've watched on Git,1
@atinjanki2651,"Great tutorial! You explained things in the simplest way possible. Enjoyed learning and understood everything you conveyed!
While following the video I noticed that doing 'git init' in the local repo creates a git repo with intial branch name - 'master'. This causes issue while pushing to the 'demo-repo2' as it has 'main' as the name of the branch.",1
@kiwibazza99,Thanks for creating and posting this video. Alot to take in but a great start into the world of Git...,1
@ob7633,Best explanation for basics in git and github,1
@3bmbm3,You are my hero ! Thanks for the crash course which helps a lot for newbies like me,1
@gillesherpoel1454,A kind thankyou! The Guide was extremely straight forward. I've learned a thing or two.,1
@hussainal-ahmdi1484,"Great video, thanks for instructor and the academic for this greatest crash course for git and github",1
@thetraveller9823,Worth contents forever for all git learners  thanks for the informative content,1
@yvanngneunmeu8763,"Great introduction to Git and Github, well explained! Thanks Gwendolyn!",1
@ahmedhassen8901,Windows users who are having an error when trying to add your sshkey ... You must create the .ssh folder and move your ssh files to the .ssh folder you created manually,1
@jan5310,A very good introduction into GIT. Thanks!,1
@haoliangwei1041,What an amazing explanation! First time to feel so clear about git,1
@davidsimek1197,"Thank you, I have interview in few days and this really helped me.",1
@tsheposerumula6283,Absolutely loved it. Thank you so much. I'll be definitely following you on your channel for more information.,1
@tusharbhatia1299,Thank you so so so much for uploading this video. You have no idea what a big help this is. It is very well explained. Kudos to you and the team. God bless.,1
@prashantdubey8248,That was crisp and clear....thank you so much for this video...really helped me a lot.,1
@Sasha-xg6xy,I think this will end up waaay above one hour tutorial for the beginners such as me :),1
@daydreamical,"This was an excellent video, can't thank you enough for sharing your knowledge in such a clear, concise and easy-to-follow way. I got a way clearer understanding of stuff I already work with and learned a lot of new stuff. Soo good, thanks again!",1
@varunr5,Well explained. Finally I have a video I can understand and refer back to.,1
@alfredoderodt6519,Thanks so much for this @FaradayAcademy. I put a lot of time in getting everything you explained and now I'm ready to contribute and manage my projects in a clean way!,1
@AkshayKumar-pk1jr,"thank you very much for this video madam. , I will follow all you channels. 

P.S. You have a beautiful voice",1
@mikolots,Gwen is an awesome teacher.,1
@ChetaMk,20:58 Please what CLI are you using to type the SSH key command and generate it? Thank you,1
@karthikshivegowda1704,I found this very useful trying to make sense of git coming from few years of other versioning system usage.,1
@archertal0762,As a beginner really appreciate it.,1
@tunichtgut5285,Great tutorial! I'd like to point out that the setup processes of the ssh-agent is Mac specific. On Linux distributions with systemd you'd use systemd/User to start ssh-agent upon login. Some distribution e.g. Ubuntu come with this service enabled by default while on others e.g. Arch Linux you have to set it up manually.,1
@AminAlSharif,"This tutorial is excellent and will look quite understandable if you have a decent knowledge of CLI commands. If it seems hard to you, better find another one or start learning CLI commands first.",1
@saurabhpratham311,Great session specially for beginners. Explains all the fundamental concepts to get started with GIT.,1
@wasimahmad9927,"Feedback: it was amazing tutorial
I have lots of doubt but all doubt are clearly so thanks a lots",1
@bjroche,"Excellent video and a great introduction covering all the essentials, thank you!",1
@cliffmathew,"This is the best git tutorial by far. Excellent job - thank you! Now going over to Twitter to subscribe. (Also people, read the comments below - some of them add useful info)",1
@junweizhang1034,"Maybe adding some theory in the end will be bettter for beginners, since understaning the theory behind those action will let them remember each step easier. Anyway, a good video. Thanks a lot for your work!",1
@NicoHeinrich,This in depth explanation was extremely effective and worthwhile. Thank you so much for sharing this!,1
@rbid,"Very nice intro to git.
It is hard for an old dog to learn new tricks, but I did learned a lot here.

Something that I think it is missing, or maybe it is more advanced topic is ""rebase"". It will be nice to have a video on this as well.

Greetings from the Galilee.",1
@qliveder5164,this channel is pure gold,1
@ErmiasShiferaw-n2y,"Great tutorial . The way you presented it made the concepts much understandable.
Thank you for sharing.",1
@pyth0477,So far this is the best beginneer friendly git and github tutorial I watched so far in my short journey of learning some programming. Thank you @freecodecamp and @gwen faraday!,1
@PunithKumarPulicharla,Examples helped me understand very quickly!!! Great work,1
@AndreaNing-x5z,"Thank you Gwen, you are an excellent teacher, very clear instructions ",1
@Peppa233pog,Loved the professional explanations and the well identified steps. Definitely gained a lot out of this video and I look forward for more.,1
@koribr764,Wonderful. So clear and to the point. Thank you,1
@edi.carlosIHS,Thank you for your video. You speak english in a good ritm to understand. Thanks for speaking about pull request in a real world. What is the good practice in merging. I was looking for a speak like that for years. Thanks.,1
@williameisner-f5t,You are really good at explaining how and why. Thank you.,1
@MMead-ti7bl,Thank you! Your classes were very helpful to this new git user.,1
@takyiwa-mensahgeorgina2429,The presentation is awesome. You made the concepts so easy to understand,1
@MichaelShingo,"This was so helpful, I finally understand basic git and it will help me work on my first team project",1
@MuhammadSodiqMirzayev-e2p,thanks for this comprehensive git and github tutorial,1
@Azeem_Idrisi,Thank you Gwen Mam for making this video. Your explanation was crystal clear and It helped me lot to learn git in a simple way.,1
@piwini,thank you do much! Gwen is an amazing teacher!,1
@DesiGameChaser27,Very good explanation. Cleared many of my doubts with regards to branching and forking,1
@liammasias7029,Thanks for the well informed tutorial! It will help me in my internship so I don’t FORK up ,1
@fahriz9163,"all the little important detail that might b useful
1:10 i feel reading caption without sound decrease the noise that is my mind
1:12 git as branded vcs object
1:38 trap our code changes",1
@deja00,Thank you. I worked my way through your tutorial. It was great.,1
@rebi6854,she explains very well. got me hyped,1
@SAMMYLEE47,A good crash course for fast learning..thank you,1
@hustler212,This really made git simple for me... Thank you very much.,1
@kelvin_thecarguy,Wow wow wow this helped me so much! I can't express how thankful I am .,1
@WWallen-ts4we,"Clear and concise explanation, loved it!",1
@TedMutwiri,You were very precise during explanation and i could easily understand.Thanks,1
@kingking8407,That is a master class tutorial. Thanks for it.,1
@zouhairmouaffaq5174,The content of the tape is beautiful from the moment your face appears in the beginning until it appears at the end,1
@cantorbernoulli4407,"if you are following along in order to list files and directories with additional details, including hidden files the equivalent command in Windows Powershell,is :
Get-ChildItem -Force",1
@zaavielgeraldkabir7430,Clear and precise tutorial. I really learnt a lot from it,1
@user-kn3yw8zl2f,This crash course was great! Thanks!!,1
@ruantos1,Thank you very much for the course. She teaches very well!,1
@mahdiesmaeili7331,"Thanks, this course is really great to get started with Git and Github :)",1
@whoviancoder,Just finished the video! Everything was very well explained and the examples were clear. Thank you\,1
@mdshahjajan7151,"@ 17:02 you could use ls -Force
command in terminal for windows system if la command 
 doesn't works for you",1
@shadyphobia5586,thanks for this effective tutorial! lots of love and respect Gwen! thank you for your incredible teaching style! you are the best!,1
@mandefrolegesse5748,Thank you so much. Your way of tutoring is very interesting and in understandable manner.,1
@christo4520,"THANKS SO MUCH FOR THIS.

This was extremely helpful and thorough. 
Cheers to using Git for managing the code chaos! :)",1
@nitinc6534,"Excellent learn,  really appreciated for easily understandable video on Git and GitHub topic.",1
@souravs6810,Just an amazing calm explanation. Thank you for the efforts,1
@collinskimutai1476,very informative git tutorial for beginners,1
@fatih-karahan,"You are really inspirational, thanks for this gwen.",1
@sergiocampana9553,"Great tutorial, had a lot of fun learning.",1
@microscaleoceanbiophsicsse8853,"Hi Gwen, very nice video and really useful. You're a great teacher!",1
@redaabakhti768,best tutorial on github by far,1
@davidruedeman9990,Great video gwen!  For me git is unintuitve but this course helped a lot.,1
@oydinabdurasulova,Thank you so much this amazing course. The knowledge I gained from it is going to so valuable. Keep up the good work,1
@misterrhombus,Best tutorial of git I've seen,1
@fiyinfoluwaenis4786,"Thank you very much for making this video. 

I love this video because it is very simple and explains important concept. I also loved how you reinforced the knowledge you had already explained by using them such as git add and git status",1
